{
  "package_id": "project-ontology",
  "domain_id": "operational-ontology-poc",
  "version": "v1",
  "imports": [],
  "object_types": [
    {
      "id": "Hypothesis",
      "primary_key": "id",
      "properties": [
        {
          "name": "id",
          "type": "string",
          "required": true,
          "immutable": true
        },
        {
          "name": "claim",
          "type": "string",
          "required": true,
          "immutable": false
        },
        {
          "name": "phase",
          "type": "string",
          "required": true,
          "immutable": false,
          "constraints": [
            "enum:DRAFT|PREREGISTERED|RUNNING|EVALUATED|SUPERSEDED"
          ]
        },
        {
          "name": "freeze_hash",
          "type": "string",
          "required": false,
          "immutable": false
        }
      ],
      "implements": [
        "VersionedResearchObject"
      ]
    },
    {
      "id": "Rival",
      "primary_key": "id",
      "properties": [
        {
          "name": "id",
          "type": "string",
          "required": true,
          "immutable": true
        },
        {
          "name": "statement",
          "type": "string",
          "required": true,
          "immutable": false
        }
      ],
      "implements": []
    },
    {
      "id": "Prediction",
      "primary_key": "id",
      "properties": [
        {
          "name": "id",
          "type": "string",
          "required": true,
          "immutable": true
        },
        {
          "name": "statement",
          "type": "string",
          "required": true,
          "immutable": false
        }
      ],
      "implements": []
    },
    {
      "id": "Falsifier",
      "primary_key": "id",
      "properties": [
        {
          "name": "id",
          "type": "string",
          "required": true,
          "immutable": true
        },
        {
          "name": "statement",
          "type": "string",
          "required": true,
          "immutable": false
        }
      ],
      "implements": []
    },
    {
      "id": "Experiment",
      "primary_key": "id",
      "properties": [
        {
          "name": "id",
          "type": "string",
          "required": true,
          "immutable": true
        },
        {
          "name": "version",
          "type": "string",
          "required": true,
          "immutable": true
        },
        {
          "name": "evidence_schema_ref",
          "type": "string",
          "required": true,
          "immutable": false
        },
        {
          "name": "evaluator_ref",
          "type": "string",
          "required": true,
          "immutable": false
        },
        {
          "name": "freeze_hash",
          "type": "string",
          "required": false,
          "immutable": false
        }
      ],
      "implements": [
        "VersionedResearchObject"
      ]
    },
    {
      "id": "Metric",
      "primary_key": "id",
      "properties": [
        {
          "name": "id",
          "type": "string",
          "required": true,
          "immutable": true
        },
        {
          "name": "name",
          "type": "string",
          "required": true,
          "immutable": false
        }
      ],
      "implements": []
    },
    {
      "id": "Threshold",
      "primary_key": "id",
      "properties": [
        {
          "name": "id",
          "type": "string",
          "required": true,
          "immutable": true
        },
        {
          "name": "value",
          "type": "json",
          "required": true,
          "immutable": false
        }
      ],
      "implements": []
    },
    {
      "id": "Evidence",
      "primary_key": "id",
      "properties": [
        {
          "name": "id",
          "type": "string",
          "required": true,
          "immutable": true
        },
        {
          "name": "payload_hash",
          "type": "string",
          "required": true,
          "immutable": true
        },
        {
          "name": "git_commit",
          "type": "string",
          "required": true,
          "immutable": true
        },
        {
          "name": "experiment_version",
          "type": "string",
          "required": true,
          "immutable": true
        },
        {
          "name": "environment",
          "type": "string",
          "required": true,
          "immutable": true
        }
      ],
      "implements": [
        "VersionedResearchObject",
        "GitBound"
      ]
    },
    {
      "id": "Verdict",
      "primary_key": "id",
      "properties": [
        {
          "name": "id",
          "type": "string",
          "required": true,
          "immutable": true
        },
        {
          "name": "value",
          "type": "string",
          "required": true,
          "immutable": true,
          "constraints": [
            "enum:SUPPORTED|REJECTED|INCONCLUSIVE|INVALID"
          ]
        },
        {
          "name": "reason",
          "type": "string",
          "required": false,
          "immutable": false
        },
        {
          "name": "derivation_hash",
          "type": "string",
          "required": true,
          "immutable": true
        },
        {
          "name": "git_commit",
          "type": "string",
          "required": true,
          "immutable": true
        }
      ],
      "implements": [
        "VersionedResearchObject",
        "GitBound"
      ]
    },
    {
      "id": "Component",
      "primary_key": "id",
      "properties": [
        {
          "name": "id",
          "type": "string",
          "required": true,
          "immutable": true
        },
        {
          "name": "path",
          "type": "string",
          "required": true,
          "immutable": false
        },
        {
          "name": "orphan_flagged",
          "type": "boolean",
          "required": true,
          "immutable": false
        }
      ],
      "implements": []
    },
    {
      "id": "ContractVersion",
      "primary_key": "id",
      "properties": [
        {
          "name": "id",
          "type": "string",
          "required": true,
          "immutable": true
        },
        {
          "name": "sha256",
          "type": "string",
          "required": true,
          "immutable": true
        },
        {
          "name": "git_commit",
          "type": "string",
          "required": true,
          "immutable": true
        },
        {
          "name": "frozen_at",
          "type": "datetime",
          "required": false,
          "immutable": false
        }
      ],
      "implements": [
        "VersionedResearchObject",
        "GitBound"
      ]
    },
    {
      "id": "Commit",
      "primary_key": "sha",
      "properties": [
        {
          "name": "sha",
          "type": "string",
          "required": true,
          "immutable": true
        },
        {
          "name": "message",
          "type": "string",
          "required": false,
          "immutable": false
        },
        {
          "name": "committed_at",
          "type": "datetime",
          "required": false,
          "immutable": false
        }
      ],
      "implements": []
    },
    {
      "id": "Test",
      "primary_key": "id",
      "properties": [
        {
          "name": "id",
          "type": "string",
          "required": true,
          "immutable": true
        },
        {
          "name": "name",
          "type": "string",
          "required": true,
          "immutable": false
        },
        {
          "name": "last_result",
          "type": "string",
          "required": false,
          "immutable": false,
          "constraints": [
            "enum:passed|failed|error"
          ]
        }
      ],
      "implements": []
    },
    {
      "id": "Decision",
      "primary_key": "id",
      "properties": [
        {
          "name": "id",
          "type": "string",
          "required": true,
          "immutable": true
        },
        {
          "name": "rationale",
          "type": "string",
          "required": true,
          "immutable": false
        },
        {
          "name": "decided_at",
          "type": "datetime",
          "required": false,
          "immutable": false
        }
      ],
      "implements": [
        "VersionedResearchObject"
      ]
    },
    {
      "id": "Failure",
      "primary_key": "id",
      "properties": [
        {
          "name": "id",
          "type": "string",
          "required": true,
          "immutable": true
        },
        {
          "name": "description",
          "type": "string",
          "required": true,
          "immutable": false
        }
      ],
      "implements": []
    }
  ],
  "link_types": [
    {
      "id": "HAS_RIVAL",
      "from": "Hypothesis",
      "to": "Rival",
      "from_cardinality": {
        "min": 0,
        "max": "*"
      },
      "to_cardinality": {
        "min": 1,
        "max": 1
      },
      "directed": true,
      "properties": []
    },
    {
      "id": "PREDICTS",
      "from": "Hypothesis",
      "to": "Prediction",
      "from_cardinality": {
        "min": 0,
        "max": "*"
      },
      "to_cardinality": {
        "min": 1,
        "max": 1
      },
      "directed": true,
      "properties": []
    },
    {
      "id": "FALSIFIED_BY",
      "from": "Hypothesis",
      "to": "Falsifier",
      "from_cardinality": {
        "min": 0,
        "max": "*"
      },
      "to_cardinality": {
        "min": 1,
        "max": 1
      },
      "directed": true,
      "properties": []
    },
    {
      "id": "TESTED_BY",
      "from": "Hypothesis",
      "to": "Experiment",
      "from_cardinality": {
        "min": 0,
        "max": "*"
      },
      "to_cardinality": {
        "min": 1,
        "max": 1
      },
      "directed": true,
      "properties": []
    },
    {